[
  {
    "id": "insight-001",
    "type": "idle",
    "instance_id": "i-0a12b34c56dev",
    "region": "us-east-1",
    "tags": { "env": "dev", "critical": false },
    "cpu_avg_7d": 1.2,
    "recommendation": "Shut down idle dev instance to save costs.",
    "target_instance_type": null,
    "confidence": 98,
    "estimated_savings_usd": 420.00
  },
  {
    "id": "insight-002",
    "type": "idle",
    "instance_id": "i-0a12b34c56prod",
    "region": "us-east-1",
    "tags": { "env": "prod", "critical": false },
    "cpu_avg_7d": 3.5,
    "recommendation": "Shut down idle production instance — requires manual approval.",
    "target_instance_type": null,
    "confidence": 95,
    "estimated_savings_usd": 680.00
  },
  {
    "id": "insight-003",
    "type": "idle",
    "instance_id": "i-critical789",
    "region": "eu-west-1",
    "tags": { "env": "prod", "critical": true },
    "cpu_avg_7d": 5.0,
    "recommendation": "Instance is idle but marked critical — do not touch.",
    "target_instance_type": null,
    "confidence": 99,
    "estimated_savings_usd": 900.00
  },
  {
    "id": "insight-004",
    "type": "over-provisioned",
    "instance_id": "i-highcpu456",
    "region": "us-west-2",
    "tags": { "env": "dev", "critical": false },
    "cpu_avg_7d": 85.0,
    "recommendation": "Instance CPU is high — no action recommended.",
    "target_instance_type": "t3.medium",
    "confidence": 72,
    "estimated_savings_usd": 150.00
  },
  {
    "id": "insight-005",
    "type": "over-provisioned",
    "instance_id": "i-resize789",
    "region": "ap-southeast-1",
    "tags": { "env": "dev", "critical": false },
    "cpu_avg_7d": 22.0,
    "recommendation": "Right-size from m5.4xlarge to m5.xlarge.",
    "target_instance_type": "m5.xlarge",
    "confidence": 92,
    "estimated_savings_usd": 310.00
  }
]
